{
  "id": "noul-passage_recurring_friction-pos-02",
  "decisionId": "passage.recurring_friction",
  "primitive": "noul",
  "state": {
    "passage": "What is the status of Atlas beta?"
  },
  "label": {
    "noul": 0.9
  },
  "split": "test",
  "notes": "synthetic pos",
  "sourceRefs": [
    "passage:2"
  ]
}
