{
  "id": "noul-job_reference_interpretation-pos-01",
  "decisionId": "job.reference_interpretation",
  "primitive": "noul",
  "state": {
    "passage": "Actually, the date is October 21."
  },
  "label": {
    "noul": 0.9
  },
  "split": "test",
  "notes": "synthetic pos",
  "sourceRefs": [
    "passage:1"
  ]
}
