{
  "id": "choice-evidence_claim_relation-insufficient-00",
  "decisionId": "evidence.claim_relation",
  "primitive": "choice",
  "state": {
    "passage": "We should move the launch to November.",
    "candidates": [
      "a",
      "b"
    ]
  },
  "label": {
    "choice": "insufficient",
    "probabilities": {
      "supports": 0.05,
      "contradicts": 0.05,
      "unrelated": 0.05,
      "insufficient": 0.85
    }
  },
  "split": "train",
  "notes": "synthetic choice",
  "sourceRefs": [
    "passage:0"
  ]
}
