{
  "id": "choice-statement_revision_relation-compatible-00",
  "decisionId": "statement.revision_relation",
  "primitive": "choice",
  "state": {
    "passage": "We should move the launch to November.",
    "candidates": [
      "a",
      "b"
    ]
  },
  "label": {
    "choice": "compatible",
    "probabilities": {
      "revision": 0.05,
      "conflict": 0.05,
      "compatible": 0.85,
      "unclear": 0.05
    }
  },
  "split": "train",
  "notes": "synthetic choice",
  "sourceRefs": [
    "passage:0"
  ]
}
