{
  "id": "choice-candidate_case_relation-unclear-00",
  "decisionId": "candidate.case_relation",
  "primitive": "choice",
  "state": {
    "passage": "We should move the launch to November.",
    "candidates": [
      "a",
      "b"
    ]
  },
  "label": {
    "choice": "unclear",
    "probabilities": {
      "yes": 0.075,
      "no": 0.075,
      "unclear": 0.85
    }
  },
  "split": "train",
  "notes": "synthetic choice",
  "sourceRefs": [
    "passage:0"
  ]
}
