{
  "id": "choice-output_criterion_satisfied-unsatisfied-01",
  "decisionId": "output.criterion_satisfied",
  "primitive": "choice",
  "state": {
    "passage": "Actually, the date is October 21.",
    "candidates": [
      "a",
      "b"
    ]
  },
  "label": {
    "choice": "unsatisfied",
    "probabilities": {
      "satisfied": 0.075,
      "unsatisfied": 0.85,
      "unclear": 0.075
    }
  },
  "split": "test",
  "notes": "synthetic choice",
  "sourceRefs": [
    "passage:1"
  ]
}
