{
  "id": "noul-passage_explicit_urgency-pos-00",
  "decisionId": "passage.explicit_urgency",
  "primitive": "noul",
  "state": {
    "passage": "We should move the launch to November."
  },
  "label": {
    "noul": 0.9
  },
  "split": "dev",
  "notes": "synthetic pos",
  "sourceRefs": [
    "passage:0"
  ]
}
