{
  "id": "choice-reference_resolution-none-01",
  "decisionId": "reference.resolution",
  "primitive": "choice",
  "state": {
    "passage": "Actually, the date is October 21.",
    "candidates": [
      "a",
      "b"
    ]
  },
  "label": {
    "choice": "none",
    "probabilities": {
      "candidates": 0.075,
      "none": 0.85,
      "unclear": 0.075
    }
  },
  "split": "test",
  "notes": "synthetic choice",
  "sourceRefs": [
    "passage:1"
  ]
}
