{
  "id": "choice-output_argument_support-insufficient-01",
  "decisionId": "output.argument_support",
  "primitive": "choice",
  "state": {
    "passage": "Actually, the date is October 21.",
    "candidates": [
      "a",
      "b"
    ]
  },
  "label": {
    "choice": "insufficient",
    "probabilities": {
      "supported": 0.05,
      "unsupported": 0.05,
      "insufficient": 0.85,
      "unclear": 0.05
    }
  },
  "split": "test",
  "notes": "synthetic choice",
  "sourceRefs": [
    "passage:1"
  ]
}
