{
  "id": "noul-passage_explicit_urgency-unc-01",
  "decisionId": "passage.explicit_urgency",
  "primitive": "noul",
  "state": {
    "passage": "Actually, the date is October 21."
  },
  "label": {
    "noul": 0.5
  },
  "split": "test",
  "notes": "synthetic unc",
  "sourceRefs": [
    "passage:1"
  ]
}
