{
  "id": "score-relevance-unrelated-04",
  "decisionId": "candidate.evidence_relevance",
  "primitive": "score",
  "state": {
    "passage": "This keeps failing every Monday standup.",
    "claim": "Atlas ships in November"
  },
  "label": {
    "score": 0.05,
    "band": "unrelated"
  },
  "split": "dev",
  "notes": "synthetic score",
  "sourceRefs": [
    "passage:4"
  ]
}
