{
  "id": "score-relevance-direct-05",
  "decisionId": "candidate.evidence_relevance",
  "primitive": "score",
  "state": {
    "passage": "Urgent: need approval before noon.",
    "claim": "Atlas ships in November"
  },
  "label": {
    "score": 0.9,
    "band": "direct"
  },
  "split": "test",
  "notes": "synthetic score",
  "sourceRefs": [
    "passage:5"
  ]
}
