{
  "id": "choice-context_target_identified-missing-00",
  "decisionId": "context.target_identified",
  "primitive": "choice",
  "state": {
    "passage": "We should move the launch to November.",
    "candidates": [
      "a",
      "b"
    ]
  },
  "label": {
    "choice": "missing",
    "probabilities": {
      "established": 0.075,
      "missing": 0.85,
      "conflicting": 0.075
    }
  },
  "split": "train",
  "notes": "synthetic choice",
  "sourceRefs": [
    "passage:0"
  ]
}
