{
  "id": "choice-evidence_claim_relation-unrelated-01",
  "decisionId": "evidence.claim_relation",
  "primitive": "choice",
  "state": {
    "passage": "Actually, the date is October 21.",
    "candidates": [
      "a",
      "b"
    ]
  },
  "label": {
    "choice": "unrelated",
    "probabilities": {
      "supports": 0.05,
      "contradicts": 0.05,
      "unrelated": 0.85,
      "insufficient": 0.05
    }
  },
  "split": "test",
  "notes": "synthetic choice",
  "sourceRefs": [
    "passage:1"
  ]
}
